<FormLayout Name="hubForm" xmlns:xsi="http://www.w3.org/2001/XMLSchema-instance" xsi:noNamespaceSchemaLocation="FormLayout.xsd">
	<ColCount>2</ColCount>
	<ItemHeight>32</ItemHeight>
	<Width>500</Width>
	<FormLayoutGroups>
		<FormLayoutGroup Caption="Идентифицирующие" ColSpan="2" Order="1">
			<FormLayoutItems>
				<FormLayoutItem Caption="Ид" Enabled="false" Order="1">
					<BoundProperty>Id</BoundProperty>
					<NestedExtension>SpinEdit</NestedExtension>
					<FormLayoutItemExtenders>
						<FormLayoutItemExtender>
							<PropertiesChain>NestedExtensionSettings.ReadOnly</PropertiesChain>
							<Value>true</Value>
						</FormLayoutItemExtender>
					</FormLayoutItemExtenders>
				</FormLayoutItem>
				<FormLayoutItem Caption="Наименование" Order="2" Enabled="true">
					<BoundProperty>Description</BoundProperty>
					<NestedExtension>TextBox</NestedExtension>
					<FormLayoutItemExtenders>
						<FormLayoutItemExtender>
							<PropertiesChain>NestedExtensionSettings.ReadOnly</PropertiesChain>
							<Value>true</Value>
						</FormLayoutItemExtender>
					</FormLayoutItemExtenders>
				</FormLayoutItem>
			</FormLayoutItems>
		</FormLayoutGroup>
		<FormLayoutGroup Caption="Основные" ColSpan="1" Order="2">
			<FormLayoutItems>
				<FormLayoutItem Caption="Заводской номер" Enabled="true" Order="1">
					<BoundProperty>FactoryNumber</BoundProperty>
					<NestedExtension>SpinEdit</NestedExtension>
					<FormLayoutItemExtenders>
						<FormLayoutItemExtender>
							<PropertiesChain>NestedExtensionSettings.Properties.MinValue</PropertiesChain>
							<Value>0</Value>
						</FormLayoutItemExtender>
						<FormLayoutItemExtender>
							<PropertiesChain>NestedExtensionSettings.Properties.NumberType</PropertiesChain>
							<Value>Integer</Value>
						</FormLayoutItemExtender>
						<FormLayoutItemExtender>
							<PropertiesChain>NestedExtensionSettings.Properties.Increment</PropertiesChain>
							<Value>1</Value>
						</FormLayoutItemExtender>
					</FormLayoutItemExtenders>
				</FormLayoutItem>
				<FormLayoutItem Caption="Сетевой идентификатор" Enabled="true" Order="2">
					<BoundProperty>Identifier</BoundProperty>
					<NestedExtension>SpinEdit</NestedExtension>
				</FormLayoutItem>
				<FormLayoutItem Caption="Строение" Order="3" Enabled="true">
					<BoundProperty>BuildingId</BoundProperty>
					<NestedExtension>ButtonEdit</NestedExtension>
					<FormLayoutItemExtenders>
						<FormLayoutItemExtender>
							<PropertiesChain>NestedExtensionSettings.ReadOnly</PropertiesChain>
							<Value>true</Value>
						</FormLayoutItemExtender>
					  <FormLayoutItemExtender>
					    <PropertiesChain>NestedExtensionSettings.Properties.ClientSideEvents.Init</PropertiesChain>
					    <Value HasEscapedContent="true">
					      function(sender, args)
					      {
					      (new Core.Admin.FormController.LinkedEntityLookupDialog()).execute({sender: sender});
					      }
					    </Value>
					  </FormLayoutItemExtender>
						<FormLayoutItemExtender>
							<PropertiesChain>NestedExtensionSettings.Properties.Buttons.Add()</PropertiesChain>
							<Value></Value>
							<TypeName>System.Delegate</TypeName>
						</FormLayoutItemExtender>
					</FormLayoutItemExtenders>
				</FormLayoutItem>
				<FormLayoutItem Caption="Считыватель данных" Enabled="true" Order="4">
					<BoundProperty>DeviceReaderId</BoundProperty>
					<NestedExtension>ComboBox</NestedExtension>
					<FormLayoutItemExtenders>
						<FormLayoutItemExtender>
							<PropertiesChain>NestedExtensionSettings.Properties.ValueField</PropertiesChain>
							<Value>Id</Value>
						</FormLayoutItemExtender>
						<FormLayoutItemExtender>
							<PropertiesChain>NestedExtensionSettings.Properties.TextField</PropertiesChain>
							<Value>Description</Value>
						</FormLayoutItemExtender>
						<FormLayoutItemExtender>
							<PropertiesChain>NestedExtensionSettings.Properties.TextFormatString</PropertiesChain>
							<Value>{2}</Value>
						</FormLayoutItemExtender>
					</FormLayoutItemExtenders>
				</FormLayoutItem>
			</FormLayoutItems>
		</FormLayoutGroup>
		<FormLayoutGroup Caption="Сетевые" ColSpan="1" Order="2">
			<FormLayoutItems>
				<FormLayoutItem Caption="Внешний IP-адрес" Enabled="true" Order="1">
					<BoundProperty>ExternalNetAddress</BoundProperty>
					<NestedExtension>TextBox</NestedExtension>
					<FormLayoutItemExtenders>
						<FormLayoutItemExtender>
							<PropertiesChain>NestedExtensionSettings.Properties.MaskSettings.Mask</PropertiesChain>
							<Value>999.999.999.999</Value>
						</FormLayoutItemExtender>
						<FormLayoutItemExtender>
							<PropertiesChain>NestedExtensionSettings.Properties.MaskSettings.IncludeLiterals</PropertiesChain>
							<Value>DecimalSymbol</Value>
						</FormLayoutItemExtender>
						<FormLayoutItemExtender>
							<PropertiesChain>NestedExtensionSettings.Properties.ValidationSettings.Display</PropertiesChain>
							<Value>None</Value>
						</FormLayoutItemExtender>
					</FormLayoutItemExtenders>
				</FormLayoutItem>
				<FormLayoutItem Caption="Внешний порт" Enabled="true" Order="2">
					<BoundProperty>ExternalPort</BoundProperty>
					<NestedExtension>SpinEdit</NestedExtension>
					<FormLayoutItemExtenders>
						<FormLayoutItemExtender>
							<PropertiesChain>NestedExtensionSettings.Properties.MinValue</PropertiesChain>
							<Value>0</Value>
						</FormLayoutItemExtender>
						<FormLayoutItemExtender>
							<PropertiesChain>NestedExtensionSettings.Properties.NumberType</PropertiesChain>
							<Value>Integer</Value>
						</FormLayoutItemExtender>
						<FormLayoutItemExtender>
							<PropertiesChain>NestedExtensionSettings.Properties.Increment</PropertiesChain>
							<Value>1</Value>
						</FormLayoutItemExtender>
					</FormLayoutItemExtenders>
				</FormLayoutItem>
				<FormLayoutItem Caption="Локальный IP-адрес" Enabled="true" Order="3">
					<BoundProperty>LocalNetAddress</BoundProperty>
					<NestedExtension>TextBox</NestedExtension>
					<FormLayoutItemExtenders>
						<FormLayoutItemExtender>
							<PropertiesChain>NestedExtensionSettings.Properties.MaskSettings.Mask</PropertiesChain>
							<Value>999.999.999.999</Value>
						</FormLayoutItemExtender>
						<FormLayoutItemExtender>
							<PropertiesChain>NestedExtensionSettings.Properties.MaskSettings.IncludeLiterals</PropertiesChain>
							<Value>DecimalSymbol</Value>
						</FormLayoutItemExtender>
						<FormLayoutItemExtender>
							<PropertiesChain>NestedExtensionSettings.Properties.ValidationSettings.Display</PropertiesChain>
							<Value>None</Value>
						</FormLayoutItemExtender>
					</FormLayoutItemExtenders>
				</FormLayoutItem>
				<FormLayoutItem Caption="Локальный порт" Enabled="true" Order="4">
					<BoundProperty>LocalPort</BoundProperty>
					<NestedExtension>SpinEdit</NestedExtension>
				</FormLayoutItem>
			</FormLayoutItems>
		</FormLayoutGroup>
	</FormLayoutGroups>
</FormLayout>
