<FormLayout Name="organizationForm" xmlns:xsi="http://www.w3.org/2001/XMLSchema-instance" xsi:noNamespaceSchemaLocation="FormLayout.xsd">
	<ColCount>2</ColCount>
	<ItemHeight>32</ItemHeight>
	<Width>500</Width>
	<FormLayoutGroups>
		<FormLayoutGroup Caption="Идентифицирующие" ColSpan="2" Order="1">
			<FormLayoutItems>
				<FormLayoutItem Caption="Ид" Enabled="false" Order="1">
					<BoundProperty>Id</BoundProperty>
					<NestedExtension>SpinEdit</NestedExtension>
					<FormLayoutItemExtenders>
						<FormLayoutItemExtender>
							<PropertiesChain>NestedExtensionSettings.ReadOnly</PropertiesChain>
							<Value>true</Value>
						</FormLayoutItemExtender>
					</FormLayoutItemExtenders>
				</FormLayoutItem>
				<FormLayoutItem Caption="Наименование" Order="2" Enabled="true">
					<BoundProperty>Description</BoundProperty>
					<NestedExtension>TextBox</NestedExtension>
					<FormLayoutItemExtenders>
						<FormLayoutItemExtender>
							<PropertiesChain>NestedExtensionSettings.ReadOnly</PropertiesChain>
							<Value>false</Value>
						</FormLayoutItemExtender>
					</FormLayoutItemExtenders>
				</FormLayoutItem>
				<FormLayoutItem Caption="Полный адрес" Enabled="true" Order="3">
					<BoundProperty>FullAddress</BoundProperty>
					<NestedExtension>ButtonEdit</NestedExtension>
					<FormLayoutItemExtenders>
						<FormLayoutItemExtender>
							<PropertiesChain>NestedExtensionSettings.Properties.Buttons.Add()</PropertiesChain>
							<Value></Value>
							<TypeName>System.Delegate</TypeName>
						</FormLayoutItemExtender>
						<FormLayoutItemExtender>
							<PropertiesChain>NestedExtensionSettings.Properties.Buttons.Add()</PropertiesChain>
							<Value></Value>
							<TypeName>System.Delegate</TypeName>
						</FormLayoutItemExtender>
						<FormLayoutItemExtender>
							<PropertiesChain>NestedExtensionSettings.Properties.ClientSideEvents.Init</PropertiesChain>
							<Value HasEscapedContent="true">
                function(sender, args)
                {
                  var context$ = jQuery(sender.GetMainElement());
                  jQuery(".dxeButton:last img", context$).hide();
                  jQuery(".dxeButton:first img", context$).hide();
                  jQuery(".dxeButton:last", context$).append(jQuery("&lt;i style=&apos;margin-right: 2px&apos; class=&apos;font-icon-google_maps&apos; title=&apos;Выбрать строение на карте&apos;&gt;&lt;/i&gt;;"));
                  jQuery(".dxeButton:first", context$).append(jQuery("&lt;i style=&apos;margin-right: 2px&apos; class=&apos;font-icon-building&apos; title=&apos;Редактировать адрес&apos;&gt;&lt;/i&gt;"));
                }        
                </Value>
						</FormLayoutItemExtender>
						<FormLayoutItemExtender>
							<PropertiesChain>NestedExtensionSettings.Properties.ClientSideEvents.ButtonClick</PropertiesChain>
							<Value HasEscapedContent="true">
                function(sender, args)
                {
                  var cusmomizer = Core.Admin.FormController.Customizer.prototype.currentInstance;
                  args["entityTypeName"] = "Organization";
                  switch(args.buttonIndex)
                  {
                    case 0:
                    {
                      cusmomizer.buttonEditShowBuildingAddressDialogHandler(sender, args);
                      break;
                    }
                    case 1:
                    {
                      cusmomizer.buttonEditShowMapDialogHandler(sender, args);
                      break;
                    }
                    default: break;
                  }
                }
                </Value>
						</FormLayoutItemExtender>
						<FormLayoutItemExtender>
							<PropertiesChain>NestedExtensionSettings.ReadOnly</PropertiesChain>
							<Value>true</Value>
						</FormLayoutItemExtender>
					</FormLayoutItemExtenders>
				</FormLayoutItem>
				<FormLayoutItem Caption="Геолокация" ClientVisible="false" Enabled="true" Order="4">
					<BoundProperty>Geolocation</BoundProperty>
					<NestedExtension>TextBox</NestedExtension>
					<FormLayoutItemExtenders>
						<FormLayoutItemExtender>
							<PropertiesChain>NestedExtensionSettings.ReadOnly</PropertiesChain>
							<Value>true</Value>
						</FormLayoutItemExtender>
					</FormLayoutItemExtenders>
				</FormLayoutItem>
			</FormLayoutItems>
		</FormLayoutGroup>
		<FormLayoutGroup Caption="Назначение" ColSpan="2" Order="2">
			<FormLayoutItems>
				<FormLayoutItem Caption="Тип организации" Enabled="true" Order="1">
					<BoundProperty>OrganizationTypeId</BoundProperty>
					<NestedExtension>ComboBox</NestedExtension>
					<FormLayoutItemExtenders>
						<FormLayoutItemExtender>
							<PropertiesChain>NestedExtensionSettings.Properties.ValueField</PropertiesChain>
							<Value>Id</Value>
						</FormLayoutItemExtender>
						<FormLayoutItemExtender>
							<PropertiesChain>NestedExtensionSettings.Properties.TextField</PropertiesChain>
							<Value>Description</Value>
						</FormLayoutItemExtender>
						<FormLayoutItemExtender>
							<PropertiesChain>NestedExtensionSettings.Properties.TextFormatString</PropertiesChain>
							<Value>{2}</Value>
						</FormLayoutItemExtender>
					</FormLayoutItemExtenders>
				</FormLayoutItem>
			</FormLayoutItems>
		</FormLayoutGroup>
	</FormLayoutGroups>
</FormLayout>
